{
    "$schema": "http://json-schema.org/schema#",
    "title": "EIP155 Chain Data",
    "type":"object",
    "required": ["name","chain","rpc","nativeCurrency","chainId","networkId"],
    "properties": {
        "name":{
            "type":"string",
            "description": "Name of the Network"
        },
        "chain":{
            "type":"string",
            "description": "Name of the Network"
        },
        "icon":{
            "type":"string",
            "description": "Icon type"
        },
        "rpc":{
            "type":"array",
            "items":{
                "type":"string"
            }
        },
        "faucets":{
            "type":"array",
            "items":{
                "type":"string"
            }
        },
        "nativeCurrency":{
            "type":"object",
            "properties": {
                "name":{
                    "type":"string",
                    "description":"Name of the Native Currency"
                },
                "symbol":{
                    "type":"string",
                    "description":"Symbol of the Native Currency"
                },
                "decimals":{
                    "type":"number",
                    "description":"Decimal points supported"
                }
            }
        },
        "infoURL":{
            "type":"string",
            "description": "infoURL"
        },
        "shortName":{
            "type":"string"
        },
        "chainId":{
            "type":"number",
            "description": "Chain ID of the Network"
        },
        "networkId":{
            "type":"number",
            "description": "Network ID of the Network"
        },
        "slip44":{
            "type":"number",
            "description": "Slip44 of the Network"
        },
        "ens":{
            "type":"object",
            "properties": {
                "registry":{
                    "type":"string"
                }
            }
        },
        "explorers":{
            "type":"array",
            "items":{
                "type":"object",
                "properties": {
                    "name":{
                        "type":"string"
                    },
                    "url":{
                        "type":"string"
                    },
                    "standard":{
                        "type":"string"
                    }
                }
            }
        }
    }
}