{
  "name": "Etherlink Testnet",
  "chain": "XTZ",
  "icon": "etherlink",
  "chainId": 128123,
  "networkId": 128123,
  "infoURL": "https://docs.etherlink.com",
  "shortName": "etherlink-testnet",
  "nativeCurrency": {
    "name": "tez",
    "symbol": "XTZ",
    "decimals": 18
  },
  "rpc": ["https://node.ghostnet.etherlink.com"],
  "faucets": ["https://faucet.etherlink.com/"],
  "explorers": [
    {
      "name": "EtherScout Testnet Explorer",
      "url": "https://explorer.etherlink.com",
      "standard": "EIP1559"
    }
  ]
}
