{
  "name": "Shine Chain",
  "chain": "Shine",
  "rpc": ["https://rpc.shinescan.io"],
  "faucets": [],
  "nativeCurrency": {
    "name": "Shine",
    "symbol": "SC20",
    "decimals": 18
  },
  "infoURL": "https://shinechain.tech",
  "shortName": "SC20",
  "chainId": 11221,
  "networkId": 11221,
  "icon": "shine",
  "explorers": [
    {
      "name": "Shine Explorer",
      "url": "https://shinescan.io",
      "icon": "shine",
      "standard": "EIP3091"
    }
  ]
}