{
  "name": "Metabit Chain Mainnet",
  "chain": "Metabit",
  "icon": "metabit",
  "rpc": [
    "https://mainnet.rpc.metabitglobal.com"
  ],
  "faucets": [
    
  ],
  "nativeCurrency": {
    "name": "Metabit Chain Native Token",
    "symbol": "BMTC",
    "decimals": 18
  },
  "infoURL": "https://metabitglobal.com",
  "shortName": "MetabitMainnet",
  "chainId": 4321,
  "networkId": 4321,
  "explorers": [
    {
      "name": "metabit_explorer",
      "url": "https://metabitglobal.io",
      "standard": "none"
    }
  ]
}
