{
  "name": "Trendz Blockchain Testnet",
  "chain": "Trendz Blockchain",
  "icon": "trendz",
  "rpc": ["https://t-rpc.trendzblockchain.com"],
  "faucets": ["https://t-faucet.trendzblockchain.com"],
  "nativeCurrency": {
    "name": "TRB",
    "symbol": "TRB",
    "decimals": 18
  },
  "infoURL": "https://www.trendzblockchain.co",
  "shortName": "TRB",
  "chainId": 71213,
  "networkId": 71213,
  "explorers": [
    {
      "name": "Trendz Blockchain Testnet Explorer",
      "url": "https://t-scan.trendzblockchain.com/",
      "standard": "EIP3091"
    }
  ]
}
