
{
  "name": "Urbit Virtual Machine",
  "chain": "UVM",
  "icon": "uvm",
  "rpc": ["https://rpc.uvm.network/"],
  "faucets": [],
  "nativeCurrency": {
    "name": "$U",
    "symbol": "U",
    "decimals": 18
  },
  "infoURL": "https://uvm.network",
  "shortName": "uvm",
  "chainId": 444,
  "networkId": 444,
  "explorers": [
    {
      "name": "UVMScan",
      "url": "https://explorer.uvm.network",
      "standard": "EIP3091"
    }
  ]
}
