{
  "name": "SEC Testnet",
  "chain": "SEC",
  "icon": "dcpayIcon",
  "rpc": ["https://testnet-rpc.secexplorer.io"],
  "faucets": ["https://faucet.secexplorer.io"],
  "nativeCurrency": {
    "name": "SEP",
    "symbol": "SEP",
    "decimals": 18
  },
  "infoURL": "https://smartenergychain.org",
  "shortName": "SECt",
  "chainId": 19515,
  "networkId": 19515,
  "explorers": [
    {
      "name": "SEC Testnet Explorer",
      "url": "https://testnet.secexplorer.io",
      "standard": "EIP3091"
    }
  ]
}
