{
  "name": "EthStorage Devnet",
  "chain": "EthStorage",
  "rpc": ["http://devnet.ethstorage.io:9540"],
  "faucets": [],
  "nativeCurrency": {
    "name": "Ether",
    "symbol": "ETH",
    "decimals": 18
  },
  "infoURL": "https://ethstorage.io/",
  "shortName": "es-d",
  "chainId": 3335,
  "networkId": 3335,
  "slip44": 1
}
