{
  "name": "DogeChain",
  "chain": "DogeChain",
  "rpc": ["https://rpc.ankr.com/dogechain"],
  "faucets": [],
  "nativeCurrency": {
    "name": "wDoge",
    "symbol": "wDOGE",
    "decimals": 18
  },
  "infoURL": "https://dogechain.dog",
  "shortName": "DC",
  "chainId": 20000,
  "networkId": 20000,
  "explorers": [
    {
      "name": "dogechain explorer",
      "url": "https://explorer.dogechain.dog",
      "standard": "EIP3091"
    }
  ]
}
