{
  "name": "The Ting Blockchain Testnet",
  "chain": "Ting",
  "rpc": ["https://testnet.tingchain.org/"],
  "faucets": [],
  "nativeCurrency": {
    "name": "Ton",
    "symbol": "Ton",
    "decimals": 18
  },
  "infoURL": "https://tingscan.com/",
  "shortName": "tingtest",
  "chainId": 6666689,
  "networkId": 6666689,
  "explorers": [
    {
      "name": "TingScan",
      "url": "https://tingscan.com/",
      "standard": "EIP3091"
    }
  ]
}
