{
  "name": "BLXq Testnet",
  "chain": "BLXQ",
  "rpc": [
    "https://testnetq1.blx.org"
  ],
  "faucets": [],
  "nativeCurrency": {
    "name": "BLXQ",
    "symbol": "BLXQ",
    "decimals": 18
  },
  "infoURL": "https://blx.org",
  "shortName": "blxq",
  "chainId": 1107,
  "networkId": 1107,
  "icon": "blxq",
  "explorers": [{
    "name": "BLXq Explorer",
    "url": "https://explorer.blx.org",
    "icon": "blxq",
    "standard": "EIP3091"
  }]
}