{
  "name": " Privix Chain Mainnet",
  "chain": "PSC",
  "rpc": [
    "https://mainnet-rpc.privixchain.xyz/",
    "wss://mainnet-rpc.privixchain.xyz/ws"
  ],
  "faucets": ["https://faucet.privixchain.xyz"],
  "nativeCurrency": {
    "name": "Privix Coin",
    "symbol": "PSC",
    "decimals": 18
  },
  "infoURL": "https://privix.co/",
  "shortName": "mpsc",
  "chainId": 16969696,
  "networkId": 16969696,
  "icon": "privix",
  "explorers": [
    {
      "name": "blockscout",
      "url": "https://mainnet.privixscan.io",
      "icon": "blockscout",
      "standard": "EIP3091"
    }
  ]
}
