{
  "name": "Fomochain Testnet",
  "chain": "Fomochain",
  "rpc": [
    "https://testnet.fomochain.us"
  ],
  "faucets": [
    "https://faucet.fomochain.us",
    "https://fauceth.komputing.org?chain=16&address=${ADDRESS}"
  ],
  "nativeCurrency": {
    "name": "FomoChain",
    "symbol": "FOMO",
    "decimals": 18
  },
  "infoURL": "https://docs.fomochain.us",
  "shortName": "",
  "chainId": 3389,
  "networkId": 3389,
  "explorers": [{
    "name": "blockscout",
    "url": "https://fomoscan.fomochain.us",
    "standard": "EIP3091"
  }]
}
