{
  "name": "RSS3 VSL Mainnet",
  "chain": "RSS3",
  "rpc": ["https://rpc.mainnet.rss3.io"],
  "faucets": [],
  "nativeCurrency": {
    "name": "RSS3",
    "symbol": "RSS3",
    "decimals": 18
  },
  "infoURL": "https://rss3.io",
  "shortName": "rss3",
  "chainId": 12553,
  "networkId": 12553,
  "icon": "rss3",
  "explorers": [
    {
      "name": "RSS3 VSL Scan",
      "url": "https://scan.mainnet.rss3.io",
      "standard": "EIP3091"
    }
  ]
}
