{
  "name": "Cerium Testnet",
  "chain": "CAU",
  "icon": "canxium",
  "rpc": ["https://cerium-rpc.canxium.net"],
  "faucets": [],
  "nativeCurrency": {
    "name": "Canxium",
    "symbol": "CAU",
    "decimals": 18
  },
  "infoURL": "https://canxium.org",
  "shortName": "cau",
  "chainId": 30103,
  "networkId": 30103,
  "explorers": [
    {
      "name": "canxium explorer",
      "url": "https://cerium-explorer.canxium.net",
      "standard": "none"
    }
  ]
}
